title,date,full_text,link
"Large language models repeat conspiracy theories and other forms of misinformation, research finds","Dec 20, 2023","New research into large language models shows that they repeat conspiracy theories, harmful stereotypes, and other forms of misinformation.",https://techxplore.com/news/2023-12-large-language-conspiracy-theories-misinformation.html
Researchers mold model for more nimble networks,"Dec 20, 2023","Roughly three decades since the dawn of the World Wide Web, the process by which data pings around the internet and to our devices has, by design, remained largely unchanged.",https://techxplore.com/news/2023-12-mold-nimble-networks.html
Computer vision system estimates speed of vehicles driving on the same road in real-time,"Dec 20, 2023",Engineers of ICAI Group of the School of Computer Science of the University of Malaga have developed a computer vision system that estimates the speed of vehicles driving on the same road in real-time.,https://techxplore.com/news/2023-12-vision-vehicles-road-real-time.html
Testing the biological reasoning capabilities of large language models,"Dec 19, 2023",Large language models (LLMs) are advanced deep learning algorithms that can process written or spoken prompts and generate texts in response to these prompts. These models have recently become increasingly popular and are ...,https://techxplore.com/news/2023-12-biological-capabilities-large-language.html
"Q&A: Alexa, am I happy? How AI emotion recognition falls short","Dec 19, 2023","Is the fear of public speaking the same as being chased by a bear? Does raising an eyebrow convey amusement or confusion? In 1995, Rosalind Picard, a scientist and inventor, introduced the idea of computers developing the ...",https://techxplore.com/news/2023-12-qa-alexa-happy-ai-emotion.html
How AI can help journalists find diverse and original sources,"Dec 19, 2023","What would news stories be without proper sources? To tell a compelling story, reporters need to find newsworthy narratives and trustworthy information. Such information typically comes from a wide pool of publications, official ...",https://techxplore.com/news/2023-12-ai-journalists-diverse-sources.html
Researchers use environmental justice questions to reveal geographic biases in ChatGPT,"Dec 16, 2023","Virginia Tech researchers have discovered limitations in ChatGPT's capacity to provide location-specific information about environmental justice issues. Their findings, published in the journal Telematics and Informatics, ...",https://techxplore.com/news/2023-12-environmental-justice-reveal-geographic-biases.html
A means for searching for new solutions in mathematics and computer science using an LLM and an evaluator,"Dec 15, 2023","A team of computer scientists at Google's DeepMind project in the U.K., working with a colleague from the University of Wisconsin-Madison and another from Université de Lyon, has developed a computer program that combines ...",https://techxplore.com/news/2023-12-solutions-mathematics-science-llm.html
Image recognition accuracy: An unseen challenge confounding today's AI,"Dec 15, 2023",Imagine you are scrolling through the photos on your phone and you come across an image that at first you can't recognize. It looks like maybe something fuzzy on the couch; could it be a pillow or a coat? After a couple of ...,https://techxplore.com/news/2023-12-image-recognition-accuracy-unseen-confounding.html
Research team develops analog hardware solution for real-time compressed sensing recovery in one step,"Dec 15, 2023","A research team led by Prof. Sun Zhong at Peking University has reported an analog hardware solution for real-time compressed sensing recovery. It has been published as an article titled, ""In-memory analog solution of compressed ...",https://techxplore.com/news/2023-12-team-analog-hardware-solution-real-time.html
Large sequence models for sequential decision-making,"Dec 15, 2023","Transformer architectures have facilitated the development of large-scale and general-purpose sequence models for prediction tasks in natural language processing and computer vision, for example, GPT-3 and Swin Transformer.",https://techxplore.com/news/2023-12-large-sequence-sequential-decision-making.html
Gathering more effective human demonstrations to teach robots new skills,"Dec 14, 2023","To effectively assist humans in real-world settings, robots should be able to learn new skills and adapt their actions based on what users require them to do at different times. One way to achieve this would be to design ...",https://techxplore.com/news/2023-12-effective-human-robots-skills.html
"YouTube video recommendations lead to more extremist content for right-leaning users, researchers suggest","Dec 14, 2023",YouTube tends to recommend videos that are similar to what people have already watched. New research has found that those recommendations can lead users down a rabbit hole of extremist political content.,https://techxplore.com/news/2023-12-youtube-video-extremist-content-right-leaning.html
Researcher creates VR sequences to test eyewitness statements,"Dec 14, 2023","Eyewitness statements are one of the key sources for identifying perpetrators—and one of the most error-prone. For example, the Innocence Project—an organization that works to clear up miscarriages of justice in the U.S.—states ...",https://techxplore.com/news/2023-12-vr-sequences-eyewitness-statements.html
"Visual active search tool combines deep reinforcement learning, traditional active search methods","Dec 14, 2023","In geospatial exploration, the quest for efficient identification of regions of interest has recently taken a leap forward with visual active search (VAS). This modeling framework uses visual cues to guide exploration with ...",https://techxplore.com/news/2023-12-visual-tool-combines-deep-traditional.html
Scientists tackle AI bias with polite prodding,"Dec 13, 2023","The troubling presence of racial bias in AI output may be easier to contain than many thought. Scientists at AI research company Anthropic say a little politeness may just do the trick, at least in some instances.",https://techxplore.com/news/2023-12-scientists-tackle-ai-bias-polite.html
Copy and paste: New AI tool helps computers interpret the world,"Dec 13, 2023","Copy and paste: It's a simple concept. You define some text or image on your computer, copy it, and paste it where you want it. Now, think of that new leather sofa you crave. Popular augmented reality (AR) apps allow you ...",https://techxplore.com/news/2023-12-ai-tool-world.html
Light-stimulated adaptive artificial synapse based on nanocrystalline metal-oxide film,"Dec 13, 2023","The quest for more efficient and versatile computing methods has given rise to innovative solutions, moving beyond traditional digital architectures. The limitations of the von Neumann architecture, which separates memory ...",https://techxplore.com/news/2023-12-light-stimulated-artificial-synapse-based-nanocrystalline.html
"Artificial intelligence systems found to excel at imitation, but not innovation","Dec 12, 2023","Artificial intelligence (AI) systems are often depicted as sentient agents poised to overshadow the human mind. But AI lacks the crucial human ability of innovation, researchers at the University of California, Berkeley have ...",https://techxplore.com/news/2023-12-artificial-intelligence-excel-imitation.html
Navigating the analytics frontier: Problem-centric thinking and the cognitive revolution,"Dec 11, 2023dialog","In today's data-driven world, data analytics has become a cornerstone of decision-making. However, despite the transformative potential, a significant number of analytics projects fail.",https://techxplore.com/news/2023-12-analytics-frontier-problem-centric-cognitive-revolution.html
"Biases in large image-text AI model favor wealthier, Western perspectives: Study","Dec 8, 2023","In a study evaluating the bias in OpenAI's CLIP, a model that pairs text and images and operates behind the scenes in the popular DALL-E image generator, University of Michigan researchers found that CLIP performs poorly ...",https://techxplore.com/news/2023-12-biases-large-image-text-ai-favor.html
"ChatGPT often won't defend its answers, even when it is right: Study finds weakness in large language models' reasoning","Dec 7, 2023","ChatGPT may do an impressive job at correctly answering complex questions, but a new study suggests it may be absurdly easy to convince the AI chatbot that it's in the wrong.",https://techxplore.com/news/2023-12-chatgpt-wont-defend-weakness-large.html
Training algorithm breaks barriers to deep physical neural networks,"Dec 7, 2023","EPFL researchers have developed an algorithm to train an analog neural network just as accurately as a digital one, enabling the development of more efficient alternatives to power-hungry deep learning hardware.",https://techxplore.com/news/2023-12-algorithm-barriers-deep-physical-neural.html
Software DJ creates automated pop song mashups,"Dec 7, 2023","Song mashups are a staple of many DJs, who mix the vocals and instrumentals from two or more tracks into a seamless blend, creating a new and exciting final product. While the result is fun to listen to, the creation process ...",https://techxplore.com/news/2023-12-software-dj-automated-song-mashups.html
Researchers develop method that boosts performance of moderation models on live platforms,"Dec 7, 2023","Twitch. Some see it as a fun online community of gamers and good-natured e-sports fandom. For others, it's a perilous stream of potentially toxic content and hate speech.",https://techxplore.com/news/2023-12-method-boosts-moderation-platforms.html
Computer scientists introduce a new method to reduce the size of multilingual language models,"Dec 7, 2023","Multilingual language models, or MLMs, are machine learning models that can predict, generate, and extract text from more than one language. They're useful for cross-lingual communication, translation, and more—but tend ...",https://techxplore.com/news/2023-12-scientists-method-size-multilingual-language.html
Brain-inspired chaotic spiking backpropagation,"Mar 29, 2024","Since it was discovered in the 1980s that learning in the rabbit brain utilizes chaos, this nonlinear and initially value-sensitive dynamical behavior has been increasingly recognized as integral to brain learning.",https://techxplore.com/news/2024-03-brain-chaotic-spiking-backpropagation.html
A biased edge enhancement method for truss-based community search,"Mar 29, 2024","Community Search, which targets a cohesive and meaningful community containing the query node, has drawn intense research interest and had extensive applications in various real-world networks recently.",https://techxplore.com/news/2024-03-biased-edge-method-truss-based.html
Q&A: How to train AI when you don't have enough data,"Mar 28, 2024",Artificial intelligence excels at sorting through information and detecting patterns or trends. But these machine learning algorithms need to be trained with large amounts of data first.,https://techxplore.com/news/2024-03-qa-ai-dont.html
Artificial intelligence boosts super-resolution microscopy,"Mar 28, 2024",Generative artificial intelligence (AI) might be best known from text or image-creating applications like ChatGPT or Stable Diffusion. But its usefulness beyond that is being shown in more and more different scientific fields.,https://techxplore.com/news/2024-03-artificial-intelligence-boosts-super-resolution.html
"New software enables blind and low-vision users to create interactive, accessible charts","Mar 27, 2024","A growing number of tools enable users to make online data representations, like charts, that are accessible for people who are blind or have low vision. However, most tools require an existing visual chart that can then ...",https://techxplore.com/news/2024-03-software-enables-vision-users-interactive.html
How long before quantum computers can benefit society? That's Google's US$5 million question,"Mar 27, 2024",Google and the XPrize Foundation have launched a competition worth US$5 million (£4 million) to develop real-world applications for quantum computers that benefit society—by speeding up progress on one of the UN Sustainable ...,https://techxplore.com/news/2024-03-quantum-benefit-society-google-us5.html
How AI and a popular card game can help engineers predict catastrophic failure by finding the absence of a pattern,"Mar 26, 2024","Humans are very good at spotting patterns, or repeating features people can recognize. For instance, ancient Polynesians navigated across the Pacific by recognizing many patterns, from the stars' constellations to more subtle ...",https://techxplore.com/news/2024-03-ai-popular-card-game-catastrophic.html
Large language models use a surprisingly simple mechanism to retrieve some stored knowledge,"Mar 25, 2024","Large language models, such as those that power popular artificial intelligence chatbots like ChatGPT, are incredibly complex. Even though these models are being used as tools in many areas, such as customer support, code ...",https://techxplore.com/news/2024-03-large-language-simple-mechanism-knowledge.html
Novel quantum algorithm proposed for high-quality solutions to combinatorial optimization problems,"Mar 25, 2024","Combinatorial optimization problems (COPs) have applications in many different fields such as logistics, supply chain management, machine learning, material design and drug discovery, among others, for finding the optimal ...",https://techxplore.com/news/2024-03-quantum-algorithm-high-quality-solutions.html
My search for the mysterious missing secretary who shaped chatbot history,"Mar 25, 2024","The Massachusetts Institute of Technology's (MIT) Distinctive Collections archive is quiet while the blizzard blows outside. Silence seems to be accumulating with the falling snow. I am the only researcher in the archive, ...",https://techxplore.com/news/2024-03-mysterious-secretary-chatbot-history.html
Researchers use environmental justice questions to reveal geographic biases in ChatGPT,"Dec 16, 2023","Virginia Tech researchers have discovered limitations in ChatGPT's capacity to provide location-specific information about environmental justice issues. Their findings, published in the journal Telematics and Informatics, ...",https://techxplore.com/news/2023-12-environmental-justice-reveal-geographic-biases.html
A means for searching for new solutions in mathematics and computer science using an LLM and an evaluator,"Dec 15, 2023","A team of computer scientists at Google's DeepMind project in the U.K., working with a colleague from the University of Wisconsin-Madison and another from Université de Lyon, has developed a computer program that combines ...",https://techxplore.com/news/2023-12-solutions-mathematics-science-llm.html
Image recognition accuracy: An unseen challenge confounding today's AI,"Dec 15, 2023",Imagine you are scrolling through the photos on your phone and you come across an image that at first you can't recognize. It looks like maybe something fuzzy on the couch; could it be a pillow or a coat? After a couple of ...,https://techxplore.com/news/2023-12-image-recognition-accuracy-unseen-confounding.html
Research team develops analog hardware solution for real-time compressed sensing recovery in one step,"Dec 15, 2023","A research team led by Prof. Sun Zhong at Peking University has reported an analog hardware solution for real-time compressed sensing recovery. It has been published as an article titled, ""In-memory analog solution of compressed ...",https://techxplore.com/news/2023-12-team-analog-hardware-solution-real-time.html
Large sequence models for sequential decision-making,"Dec 15, 2023","Transformer architectures have facilitated the development of large-scale and general-purpose sequence models for prediction tasks in natural language processing and computer vision, for example, GPT-3 and Swin Transformer.",https://techxplore.com/news/2023-12-large-sequence-sequential-decision-making.html
Gathering more effective human demonstrations to teach robots new skills,"Dec 14, 2023","To effectively assist humans in real-world settings, robots should be able to learn new skills and adapt their actions based on what users require them to do at different times. One way to achieve this would be to design ...",https://techxplore.com/news/2023-12-effective-human-robots-skills.html
"YouTube video recommendations lead to more extremist content for right-leaning users, researchers suggest","Dec 14, 2023",YouTube tends to recommend videos that are similar to what people have already watched. New research has found that those recommendations can lead users down a rabbit hole of extremist political content.,https://techxplore.com/news/2023-12-youtube-video-extremist-content-right-leaning.html
Researcher creates VR sequences to test eyewitness statements,"Dec 14, 2023","Eyewitness statements are one of the key sources for identifying perpetrators—and one of the most error-prone. For example, the Innocence Project—an organization that works to clear up miscarriages of justice in the U.S.—states ...",https://techxplore.com/news/2023-12-vr-sequences-eyewitness-statements.html
"Visual active search tool combines deep reinforcement learning, traditional active search methods","Dec 14, 2023","In geospatial exploration, the quest for efficient identification of regions of interest has recently taken a leap forward with visual active search (VAS). This modeling framework uses visual cues to guide exploration with ...",https://techxplore.com/news/2023-12-visual-tool-combines-deep-traditional.html
Scientists tackle AI bias with polite prodding,"Dec 13, 2023","The troubling presence of racial bias in AI output may be easier to contain than many thought. Scientists at AI research company Anthropic say a little politeness may just do the trick, at least in some instances.",https://techxplore.com/news/2023-12-scientists-tackle-ai-bias-polite.html
Copy and paste: New AI tool helps computers interpret the world,"Dec 13, 2023","Copy and paste: It's a simple concept. You define some text or image on your computer, copy it, and paste it where you want it. Now, think of that new leather sofa you crave. Popular augmented reality (AR) apps allow you ...",https://techxplore.com/news/2023-12-ai-tool-world.html
Light-stimulated adaptive artificial synapse based on nanocrystalline metal-oxide film,"Dec 13, 2023","The quest for more efficient and versatile computing methods has given rise to innovative solutions, moving beyond traditional digital architectures. The limitations of the von Neumann architecture, which separates memory ...",https://techxplore.com/news/2023-12-light-stimulated-artificial-synapse-based-nanocrystalline.html
"Artificial intelligence systems found to excel at imitation, but not innovation","Dec 12, 2023","Artificial intelligence (AI) systems are often depicted as sentient agents poised to overshadow the human mind. But AI lacks the crucial human ability of innovation, researchers at the University of California, Berkeley have ...",https://techxplore.com/news/2023-12-artificial-intelligence-excel-imitation.html
Navigating the analytics frontier: Problem-centric thinking and the cognitive revolution,"Dec 11, 2023dialog","In today's data-driven world, data analytics has become a cornerstone of decision-making. However, despite the transformative potential, a significant number of analytics projects fail.",https://techxplore.com/news/2023-12-analytics-frontier-problem-centric-cognitive-revolution.html
"Biases in large image-text AI model favor wealthier, Western perspectives: Study","Dec 8, 2023","In a study evaluating the bias in OpenAI's CLIP, a model that pairs text and images and operates behind the scenes in the popular DALL-E image generator, University of Michigan researchers found that CLIP performs poorly ...",https://techxplore.com/news/2023-12-biases-large-image-text-ai-favor.html
"ChatGPT often won't defend its answers, even when it is right: Study finds weakness in large language models' reasoning","Dec 7, 2023","ChatGPT may do an impressive job at correctly answering complex questions, but a new study suggests it may be absurdly easy to convince the AI chatbot that it's in the wrong.",https://techxplore.com/news/2023-12-chatgpt-wont-defend-weakness-large.html
Training algorithm breaks barriers to deep physical neural networks,"Dec 7, 2023","EPFL researchers have developed an algorithm to train an analog neural network just as accurately as a digital one, enabling the development of more efficient alternatives to power-hungry deep learning hardware.",https://techxplore.com/news/2023-12-algorithm-barriers-deep-physical-neural.html
Software DJ creates automated pop song mashups,"Dec 7, 2023","Song mashups are a staple of many DJs, who mix the vocals and instrumentals from two or more tracks into a seamless blend, creating a new and exciting final product. While the result is fun to listen to, the creation process ...",https://techxplore.com/news/2023-12-software-dj-automated-song-mashups.html
Researchers develop method that boosts performance of moderation models on live platforms,"Dec 7, 2023","Twitch. Some see it as a fun online community of gamers and good-natured e-sports fandom. For others, it's a perilous stream of potentially toxic content and hate speech.",https://techxplore.com/news/2023-12-method-boosts-moderation-platforms.html
Computer scientists introduce a new method to reduce the size of multilingual language models,"Dec 7, 2023","Multilingual language models, or MLMs, are machine learning models that can predict, generate, and extract text from more than one language. They're useful for cross-lingual communication, translation, and more—but tend ...",https://techxplore.com/news/2023-12-scientists-method-size-multilingual-language.html
A year of ChatGPT: 5 ways AI has changed the world,"Dec 2, 2023",OpenAI's artificial intelligence (AI) chatbot ChatGPT was unleashed onto an unsuspecting public exactly one year ago.,https://techxplore.com/news/2023-11-year-chatgpt-ways-ai-world.html
AI researchers introduce GAIA: A benchmark testing tool for general AI assistants,"Dec 1, 2023","A team of researchers affiliated with AI startups Gen AI, Meta, AutoGPT, HuggingFace and Fair Meta, has developed a benchmark tool for use by makers of AI assistants, particularly those that make Large Language Model based ...",https://techxplore.com/news/2023-12-ai-gaia-benchmark-tool-general.html
"AI image generator Stable Diffusion perpetuates racial and gendered stereotypes, study finds","Nov 30, 2023","What does a person look like? If you use the popular artificial intelligence image generator Stable Diffusion to conjure answers, too frequently you'll see images of light-skinned men.",https://techxplore.com/news/2023-11-ai-image-generator-stable-diffusion.html
Researchers tackle a century-old teletraffic challenge to enhance medical and public service efficiency,"Nov 30, 2023","Efficiently meeting the growing demand for public services in metropolitan areas has long been a persistent challenge. A research team at City University of Hong Kong (CityU) has developed a novel performance evaluation method, ...",https://techxplore.com/news/2023-11-tackle-century-old-teletraffic-medical-efficiency.html
ChatGPT turns 1: AI chatbot's success says as much about humans as technology,"Nov 30, 2023","ChatGPT was launched on Nov. 30, 2022, ushering in what many have called artificial intelligence's breakout year. Within days of its release, ChatGPT went viral. Screenshots of conversations snowballed across social media, ...",https://techxplore.com/news/2023-11-chatgpt-ai-chatbot-success-humans.html
Mathematicians make 5G network scheme more efficient and reliable,"Nov 29, 2023","Mathematicians from RUDN University have proposed a new scheme for 5G networks that optimizes access to different network segments. The number of non-priority tasks awaiting the start of execution or interruption has halved, ...",https://techxplore.com/news/2023-11-mathematicians-5g-network-scheme-efficient.html
Researchers develop large language model for medical knowledge,"Nov 28, 2023","Researchers from EPFL have just released Meditron, the world's best performing open source large language model tailored to the medical field designed to help guide clinical decision-making.",https://techxplore.com/news/2023-11-large-language-medical-knowledge.html
Unleashing the power of soft-decision decoding in DNA digital storage,"Nov 28, 2023","Led by Dr. Jue Ruan and Dr. Weihua Pan, a study published in the journal National Science Review delves into the realm of DNA digital storage (DDS), a technology acclaimed for its high-density (EB/g), long-term (million years) ...",https://techxplore.com/news/2023-11-unleashing-power-soft-decision-decoding-dna.html
Study shows ChatGPT writes better school essays than students,"Nov 27, 2023","In a study published in Scientific Reports, a research team from the University of Passau compared the quality of machine-generated content with essays written by secondary school students. The upshot: The AI-based chatbot ...",https://techxplore.com/news/2023-11-chatgpt-school-essays-students.html
Study: Immersive engagement in mixed reality can be measured with reaction time,"Nov 27, 2023","In the real world/digital world cross-over of mixed reality, a user's immersive engagement with the program is called presence. Now, UMass Amherst researchers are the first to identify reaction time as a potential presence ...",https://techxplore.com/news/2023-11-immersive-engagement-reality-reaction.html
