title,date,full_text,link
Apple's Keyframer can animate simple drawings using text descriptions,"Feb 16, 2024","Machine learning researchers at Apple have developed an application that can accept a simple drawing and a text description to animate the drawing in desired ways. Tiffany Tseng, Ruijia Cheng and Jeffrey Nichols have published ...",https://techxplore.com/news/2024-02-apple-keyframer-animate-simple-text.html
Computer scientists develop model that explains how collective scenarios such as diseases may proceed,"Feb 16, 2024","It is winter, the typical time for colds. What if you could simulate how the disease may spread? At the Cluster of Excellence Collective Behavior at the University of Konstanz, Julia Klein, a doctoral student in computer ...",https://techxplore.com/news/2024-02-scientists-scenarios-diseases-proceed.html
From game footage to great footage with computer vision and other artificial intelligence tools,"Feb 16, 2024",How much cooler would basketball footage be if software could automatically shine a spotlight on key players? How much easier would it be to understand plays if arrows could indicate movement before the players actually move? ...,https://techxplore.com/news/2024-02-game-footage-great-vision-artificial.html
AI tools produce dazzling results—but do they really have 'intelligence'?,"Feb 14, 2024","Sam Altman, chief executive of ChatGPT-maker OpenAI, is reportedly trying to find up to US$7 trillion of investment to manufacture the enormous volumes of computer chips he believes the world needs to run artificial intelligence ...",https://techxplore.com/news/2024-02-ai-tools-dazzling-results-intelligence.html
Artificial intelligence needs to be trained on culturally diverse datasets to avoid bias,"Feb 14, 2024","Large language models (LLMs) are deep learning artificial intelligence programs, like OpenAI's ChatGPT. The capabilities of LLMs have developed into quite a wide range, from writing fluent essays, through coding to creative ...",https://techxplore.com/news/2024-02-artificial-intelligence-culturally-diverse-datasets.html
Mathematicians build an algorithm for 5G network slicing,"Feb 14, 2024","One of the features of 5G networks is so-called slicing, which is segmentation of the network. Physically, the network remains the same but is logically divided into slices depending on current requests. This approach guarantees ...",https://techxplore.com/news/2024-02-mathematicians-algorithm-5g-network-slicing.html
A new way to let AI chatbots converse all day without crashing,"Feb 13, 2024","When a human-AI conversation involves many rounds of continuous dialogue, the powerful large language machine-learning models that drive chatbots like ChatGPT sometimes start to collapse, causing the bots' performance to ...",https://techxplore.com/news/2024-02-ai-chatbots-converse-day.html
AI is everywhere—including countless applications you've likely never heard of,"Feb 12, 2024","Artificial intelligence (AI) is seemingly everywhere. Right now, generative AI in particular—tools like Midjourney, ChatGPT, Gemini (previously Bard) and others—is at the peak of hype.",https://techxplore.com/news/2024-02-ai-countless-applications-youve-heard.html
AI in the developing world: How 'tiny machine learning' can have a big impact,"Feb 10, 2024","The landscape of artificial intelligence (AI) applications has traditionally been dominated by the use of resource-intensive servers centralized in industrialized nations. However, recent years have witnessed the emergence ...",https://techxplore.com/news/2024-02-ai-world-tiny-machine-big.html
Brain-inspired chaotic spiking backpropagation,"Mar 29, 2024","Since it was discovered in the 1980s that learning in the rabbit brain utilizes chaos, this nonlinear and initially value-sensitive dynamical behavior has been increasingly recognized as integral to brain learning.",https://techxplore.com/news/2024-03-brain-chaotic-spiking-backpropagation.html
A biased edge enhancement method for truss-based community search,"Mar 29, 2024","Community Search, which targets a cohesive and meaningful community containing the query node, has drawn intense research interest and had extensive applications in various real-world networks recently.",https://techxplore.com/news/2024-03-biased-edge-method-truss-based.html
Q&A: How to train AI when you don't have enough data,"Mar 28, 2024",Artificial intelligence excels at sorting through information and detecting patterns or trends. But these machine learning algorithms need to be trained with large amounts of data first.,https://techxplore.com/news/2024-03-qa-ai-dont.html
Artificial intelligence boosts super-resolution microscopy,"Mar 28, 2024",Generative artificial intelligence (AI) might be best known from text or image-creating applications like ChatGPT or Stable Diffusion. But its usefulness beyond that is being shown in more and more different scientific fields.,https://techxplore.com/news/2024-03-artificial-intelligence-boosts-super-resolution.html
"New software enables blind and low-vision users to create interactive, accessible charts","Mar 27, 2024","A growing number of tools enable users to make online data representations, like charts, that are accessible for people who are blind or have low vision. However, most tools require an existing visual chart that can then ...",https://techxplore.com/news/2024-03-software-enables-vision-users-interactive.html
How long before quantum computers can benefit society? That's Google's US$5 million question,"Mar 27, 2024",Google and the XPrize Foundation have launched a competition worth US$5 million (£4 million) to develop real-world applications for quantum computers that benefit society—by speeding up progress on one of the UN Sustainable ...,https://techxplore.com/news/2024-03-quantum-benefit-society-google-us5.html
How AI and a popular card game can help engineers predict catastrophic failure by finding the absence of a pattern,"Mar 26, 2024","Humans are very good at spotting patterns, or repeating features people can recognize. For instance, ancient Polynesians navigated across the Pacific by recognizing many patterns, from the stars' constellations to more subtle ...",https://techxplore.com/news/2024-03-ai-popular-card-game-catastrophic.html
Large language models use a surprisingly simple mechanism to retrieve some stored knowledge,"Mar 25, 2024","Large language models, such as those that power popular artificial intelligence chatbots like ChatGPT, are incredibly complex. Even though these models are being used as tools in many areas, such as customer support, code ...",https://techxplore.com/news/2024-03-large-language-simple-mechanism-knowledge.html
Novel quantum algorithm proposed for high-quality solutions to combinatorial optimization problems,"Mar 25, 2024","Combinatorial optimization problems (COPs) have applications in many different fields such as logistics, supply chain management, machine learning, material design and drug discovery, among others, for finding the optimal ...",https://techxplore.com/news/2024-03-quantum-algorithm-high-quality-solutions.html
My search for the mysterious missing secretary who shaped chatbot history,"Mar 25, 2024","The Massachusetts Institute of Technology's (MIT) Distinctive Collections archive is quiet while the blizzard blows outside. Silence seems to be accumulating with the falling snow. I am the only researcher in the archive, ...",https://techxplore.com/news/2024-03-mysterious-secretary-chatbot-history.html
Audio explainable artificial intelligence: Demystifying 'black box' models,"Feb 26, 2024","AI decision-making is now common in self-driving cars, patient diagnosis and legal consultation, and it needs to be safe and trustworthy. Researchers have been trying to demystify complex AI models by developing interpretable ...",https://techxplore.com/news/2024-02-audio-artificial-intelligence-demystifying-black.html
Method identified to double computer processing speeds,"Feb 22, 2024","Imagine doubling the processing power of your smartphone, tablet, personal computer, or server using the existing hardware already in these devices.",https://techxplore.com/news/2024-02-method.html
Adaptive fusion of structure and attribute-guided polarized communities search,"Feb 22, 2024","The exploration of polarized communities, which consist of two antagonistic subgraphs and include a set of query nodes, is a crucial task in community search on signed networks. Most existing methods either predominantly ...",https://techxplore.com/news/2024-02-fusion-attribute-polarized-communities.html
Quantum annealers and the future of prime factorization,"Feb 21, 2024","Researchers at the University of Trento, Italy, have developed a novel approach for prime factorization via quantum annealing, leveraging a compact modular encoding paradigm and enabling the factorization of large numbers ...",https://techxplore.com/news/2024-02-quantum-annealers-future-prime-factorization.html
Charting new paths in AI learning: How changing two variables leads to vastly different outcomes,"Feb 21, 2024","In an era where artificial intelligence (AI) is transforming industries from health care to finance, understanding how these digital brains learn is more crucial than ever. Now, two researchers from EPFL, Antonia Sclocchi ...",https://techxplore.com/news/2024-02-paths-ai-variables-vastly-outcomes.html
Automated method helps researchers quantify uncertainty in their predictions,"Feb 21, 2024",Pollsters trying to predict presidential election results and physicists searching for distant exoplanets have at least one thing in common: They often use a tried-and-true scientific technique called Bayesian inference.,https://techxplore.com/news/2024-02-automated-method-quantify-uncertainty.html
"New system combines human, artificial intelligence to improve experimentation","Feb 21, 2024","Though artificial intelligence decreases human error in experimentation, human experts outperform AI when identifying causation or working with small data sets.",https://techxplore.com/news/2024-02-combines-human-artificial-intelligence-experimentation.html
In-depth analysis: Automated machine learning from the perspective of bilevel optimization,"Feb 21, 2024","Recently, professors Risheng Liu from Dalian University of Technology and Zhouchen Lin from Peking University collaborated on an opinion article published in the National Science Review (NSR). Their article delves deeply ...",https://techxplore.com/news/2024-02-depth-analysis-automated-machine-perspective.html
Science fiction meets reality as researchers develop techniques to overcome obstructed views,"Feb 20, 2024","After a recent car crash, John Murray-Bruce wished he could have seen the other car coming. The crash reaffirmed the USF assistant professor of computer science and engineering's mission to create a technology that could ...",https://techxplore.com/news/2024-02-science-fiction-reality-techniques-obstructed.html
"The YouTube algorithm isn't radicalizing people, says bots study","Feb 20, 2024","About a quarter of Americans get their news on YouTube. With its billions of users and hours upon hours of content, YouTube is one the largest online media platforms in the world.",https://techxplore.com/news/2024-02-youtube-algorithm-isnt-radicalizing-people.html
Amazon unveils largest text-to-speech model ever made,"Feb 17, 2024","A team of artificial intelligence researchers at Amazon AGI announced the development of what they are describing as the largest text-to-speech model ever made. By largest, they mean having the most parameters and using the ...",https://techxplore.com/news/2024-02-amazon-unveils-largest-text-speech.html
Apple's Keyframer can animate simple drawings using text descriptions,"Feb 16, 2024","Machine learning researchers at Apple have developed an application that can accept a simple drawing and a text description to animate the drawing in desired ways. Tiffany Tseng, Ruijia Cheng and Jeffrey Nichols have published ...",https://techxplore.com/news/2024-02-apple-keyframer-animate-simple-text.html
Computer scientists develop model that explains how collective scenarios such as diseases may proceed,"Feb 16, 2024","It is winter, the typical time for colds. What if you could simulate how the disease may spread? At the Cluster of Excellence Collective Behavior at the University of Konstanz, Julia Klein, a doctoral student in computer ...",https://techxplore.com/news/2024-02-scientists-scenarios-diseases-proceed.html
From game footage to great footage with computer vision and other artificial intelligence tools,"Feb 16, 2024",How much cooler would basketball footage be if software could automatically shine a spotlight on key players? How much easier would it be to understand plays if arrows could indicate movement before the players actually move? ...,https://techxplore.com/news/2024-02-game-footage-great-vision-artificial.html
AI tools produce dazzling results—but do they really have 'intelligence'?,"Feb 14, 2024","Sam Altman, chief executive of ChatGPT-maker OpenAI, is reportedly trying to find up to US$7 trillion of investment to manufacture the enormous volumes of computer chips he believes the world needs to run artificial intelligence ...",https://techxplore.com/news/2024-02-ai-tools-dazzling-results-intelligence.html
Artificial intelligence needs to be trained on culturally diverse datasets to avoid bias,"Feb 14, 2024","Large language models (LLMs) are deep learning artificial intelligence programs, like OpenAI's ChatGPT. The capabilities of LLMs have developed into quite a wide range, from writing fluent essays, through coding to creative ...",https://techxplore.com/news/2024-02-artificial-intelligence-culturally-diverse-datasets.html
Mathematicians build an algorithm for 5G network slicing,"Feb 14, 2024","One of the features of 5G networks is so-called slicing, which is segmentation of the network. Physically, the network remains the same but is logically divided into slices depending on current requests. This approach guarantees ...",https://techxplore.com/news/2024-02-mathematicians-algorithm-5g-network-slicing.html
A new way to let AI chatbots converse all day without crashing,"Feb 13, 2024","When a human-AI conversation involves many rounds of continuous dialogue, the powerful large language machine-learning models that drive chatbots like ChatGPT sometimes start to collapse, causing the bots' performance to ...",https://techxplore.com/news/2024-02-ai-chatbots-converse-day.html
AI is everywhere—including countless applications you've likely never heard of,"Feb 12, 2024","Artificial intelligence (AI) is seemingly everywhere. Right now, generative AI in particular—tools like Midjourney, ChatGPT, Gemini (previously Bard) and others—is at the peak of hype.",https://techxplore.com/news/2024-02-ai-countless-applications-youve-heard.html
AI in the developing world: How 'tiny machine learning' can have a big impact,"Feb 10, 2024","The landscape of artificial intelligence (AI) applications has traditionally been dominated by the use of resource-intensive servers centralized in industrialized nations. However, recent years have witnessed the emergence ...",https://techxplore.com/news/2024-02-ai-world-tiny-machine-big.html
Joint learning for mask wearing detection in low-light conditions,"Feb 5, 2024","Face mask wearing detection is an important technical approach to improve public health safety and real-time monitoring efficiency. However, under extreme lighting or weather conditions, it is difficult to achieve ideal results ...",https://techxplore.com/news/2024-02-joint-mask-conditions.html
AI and the human body: Hidden assumptions in motion capture can have serious impact,"Feb 2, 2024","When designers use inaccurate depictions of the human body, the use of artificial intelligence in some applications might not be as safe for those who don't fit that body type, according to a new study posted to the arXiv ...",https://techxplore.com/news/2024-02-ai-human-body-hidden-assumptions.html
Computer scientists run a password update campaign efficiently and with minimal IT costs,"Feb 1, 2024",Updating passwords for all users of a company or institution's internal computer systems is stressful and disruptive to both users and IT professionals. Many studies have looked at user struggles and password best practices. ...,https://techxplore.com/news/2024-02-scientists-password-campaign-efficiently-minimal.html
A theoretical model for reliability assessment of machine learning systems,"Feb 1, 2024","For a machine learning system comprising multiple machine learning models and input data, researchers at University of Tsukuba developed a theoretical model for evaluating the effect of diversity in machine learning models ...",https://techxplore.com/news/2024-02-theoretical-reliability-machine.html
Bringing supercomputers and experiments together to accelerate discoveries,"Jan 31, 2024",The seamless integration of DOE's large-scale experimental facilities and powerful computing resources will help researchers keep pace with the ever-increasing influx of scientific data.,https://techxplore.com/news/2024-01-supercomputers-discoveries.html
The future of AI could be great—or catastrophic,"Jan 30, 2024","A survey of nearly 3,000 machine learning experts on how our lives will be different in an AI world has been completed and the results are in.",https://techxplore.com/news/2024-01-future-ai-great-catastrophic.html
"Fighting deepfakes, shallowfakes and media manipulation","Jan 30, 2024","Photo, audio and video technologies have advanced significantly in recent years, making it easier to create convincing fake multimedia content, like politicians singing popular songs or saying silly things to get a laugh ...",https://techxplore.com/news/2024-01-deepfakes-shallowfakes-media.html
Researchers harness large language models to accelerate materials discovery,"Jan 29, 2024","Princeton researchers have created an artificial intelligence (AI) tool to predict the behavior of crystalline materials, a key step in advancing technologies such as batteries and semiconductors. Although computer simulations ...",https://techxplore.com/news/2024-01-harness-large-language-materials-discovery.html
Vehicle networking environment information sharing based on distributed fountain code,"Jan 29, 2024","Intelligent Transportation systems (ITS) have shown great potential in smart cities in recent years. Using information processing and communication technology, ITS significantly improves the quality of urban traffic operation ...",https://techxplore.com/news/2024-01-vehicle-networking-environment-based-fountain.html
Fingerprinting with machine vision,"Jan 29, 2024",Traditional fingerprint identification methods can struggle with accurately identifying feature points in smaller regions. This is usually where a subset of fingerprints that are of limited size might typically be found in ...,https://techxplore.com/news/2024-01-fingerprinting-machine-vision.html
"Google announces the development of Lumiere, an AI-based next-generation text-to-video generator","Jan 26, 2024",A team of AI researchers at Google Research has developed a next-generation AI-based text-to-video generator called Lumiere. The group has published a paper describing their efforts on the arXiv preprint server.,https://techxplore.com/news/2024-01-google-lumiere-ai-based-generation.html
What if American nuclear power plants could be less expensive,"Jan 26, 2024","American nuclear power plants generate more than 20% of the electricity, and half of the carbon-free electricity, in the United States. The nation's pressing demand for even more electricity—specifically carbon-free electricity ...",https://techxplore.com/news/2024-01-american-nuclear-power-expensive.html
Researchers develop a multiscale feature modulation network for advanced underwater image enhancement,"Jan 26, 2024",Researchers led by Prof. Wang Rujing from the Hefei Institutes of Physical Science of the Chinese Academy of Sciences developed a simple and effective multi-scale feature modulation network for underwater image enhancement.,https://techxplore.com/news/2024-01-multiscale-feature-modulation-network-advanced.html
Computer scientists invent simple method to speed cache sifting,"Jan 24, 2024","Computer scientists have invented a highly effective—yet incredibly simple—algorithm to decide which items to toss from a web cache to make room for new ones. Known as SIEVE, the new open-source algorithm holds the potential ...",https://techxplore.com/news/2024-01-scientists-simple-method-cache-sifting.html
"Research reveals that blockchain technology is probably unnecessary in the majority of cases, despite its popularity","Jan 24, 2024","In recent years blockchain technology has been making headlines and boomed in popularity, thanks partly to its use in the cryptocurrency Bitcoin. But, new research from the University of Birmingham published in Telematics ...",https://techxplore.com/news/2024-01-reveals-blockchain-technology-unnecessary-majority.html
Misinformation and irresponsible AI: Experts forecast how technology may shape our near future,"Jan 24, 2024","From misinformation and invisible cyber attacks to irresponsible AI that could cause events involving multiple deaths, expert futurists have forecast how rapid technology changes may shape our world by 2040.",https://techxplore.com/news/2024-01-misinformation-irresponsible-ai-experts-technology.html
AI learns to simulate how trees grow and shape in response to their environments,"Jan 22, 2024","A research team from Purdue University's Department of Computer Science and Institute for Digital Forestry, with collaborator Sören Pirk at Kiel University in Germany, has discovered that artificial intelligence can simulate ...",https://techxplore.com/news/2024-01-ai-simulate-trees-response-environments.html
Researchers unveil new way to counter mobile phone 'account takeover' attacks,"Jan 22, 2024","Computer science researchers have developed a new way to identify security weaknesses that leave people vulnerable to account takeover attacks, where a hacker gains unauthorized access to online accounts.",https://techxplore.com/news/2024-01-unveil-counter-mobile-account-takeover.html
DeepMind's AI system AlphaGeometry able to solve complex geometry problems at a high level,"Jan 19, 2024","A team of AI researchers at Google's DeepMind, working with a colleague from New York University, has developed an AI system called AlphaGeometry that has demonstrated an ability to solve complex geometry problems at a high ...",https://techxplore.com/news/2024-01-deepmind-ai-alphageometry-complex-geometry.html
Researchers demonstrate scalability of graph neural networks on world's most powerful computing systems,"Jan 19, 2024","Solving today's most complex scientific challenges often means tracing links between hundreds, thousands or even millions of variables. The larger the scientific dataset, the more complex these connections become.",https://techxplore.com/news/2024-01-scalability-graph-neural-networks-world.html
Brain-inspired chaotic spiking backpropagation,"Mar 29, 2024","Since it was discovered in the 1980s that learning in the rabbit brain utilizes chaos, this nonlinear and initially value-sensitive dynamical behavior has been increasingly recognized as integral to brain learning.",https://techxplore.com/news/2024-03-brain-chaotic-spiking-backpropagation.html
A biased edge enhancement method for truss-based community search,"Mar 29, 2024","Community Search, which targets a cohesive and meaningful community containing the query node, has drawn intense research interest and had extensive applications in various real-world networks recently.",https://techxplore.com/news/2024-03-biased-edge-method-truss-based.html
Q&A: How to train AI when you don't have enough data,"Mar 28, 2024",Artificial intelligence excels at sorting through information and detecting patterns or trends. But these machine learning algorithms need to be trained with large amounts of data first.,https://techxplore.com/news/2024-03-qa-ai-dont.html
Artificial intelligence boosts super-resolution microscopy,"Mar 28, 2024",Generative artificial intelligence (AI) might be best known from text or image-creating applications like ChatGPT or Stable Diffusion. But its usefulness beyond that is being shown in more and more different scientific fields.,https://techxplore.com/news/2024-03-artificial-intelligence-boosts-super-resolution.html
"New software enables blind and low-vision users to create interactive, accessible charts","Mar 27, 2024","A growing number of tools enable users to make online data representations, like charts, that are accessible for people who are blind or have low vision. However, most tools require an existing visual chart that can then ...",https://techxplore.com/news/2024-03-software-enables-vision-users-interactive.html
How long before quantum computers can benefit society? That's Google's US$5 million question,"Mar 27, 2024",Google and the XPrize Foundation have launched a competition worth US$5 million (£4 million) to develop real-world applications for quantum computers that benefit society—by speeding up progress on one of the UN Sustainable ...,https://techxplore.com/news/2024-03-quantum-benefit-society-google-us5.html
How AI and a popular card game can help engineers predict catastrophic failure by finding the absence of a pattern,"Mar 26, 2024","Humans are very good at spotting patterns, or repeating features people can recognize. For instance, ancient Polynesians navigated across the Pacific by recognizing many patterns, from the stars' constellations to more subtle ...",https://techxplore.com/news/2024-03-ai-popular-card-game-catastrophic.html
